Title,Authors,Year,Source title,DOI,EID,Abstract,Author Keywords,Document Type,Selection_Decision,Selection_Justification
"Parties, persons, and one-at-a-time: conversation analysis and ELF; [Parties Personen und ""one-at-a-time"": Konversationsanalyse und ELF]",Santner-Wolfartsberger A.,2015,Journal of English as a Lingua Franca,10.1515/jelf-2015-0020,2-s2.0-85016177959,"Drawing on an analysis of ELF data, this article deals with the characteristics and complexities of turn-taking in interactions involving three or more participants. Sacks et al.'s (1974) often quoted framework for turn-taking in conversations, which can still be regarded canonical reading in the conversation analytic literature, serves as a starting point for this investigation. The aim of this paper is to scrutinize the applicability of the turn-taking model for group interactions. A key concept in this regard is the notion of a party: the conversation analytic model for turn-taking posits that turn-taking does not take place between individual speakers, but between parties (hence the term multi-party conversation) which can potentially consist of several speakers (cf. Schegloff 1995: 32-33). In group interactions it is thus possible that overlap occurs among co-incumbents of the same party. This kind of simultaneous speech, however, has not yet been subject of systematic empirical analysis. The present paper offers a preliminary account of this aspect of turn-taking in multi-participant interaction by discussing data extracts from an ELF workplace meeting of seven speakers and suggests possible avenues for further research on the phenomenon.  © 2015 by De Gruyter Mouton 2015.","""party; conversation analysis; English as a lingua franca; multi-participant interaction; turn-taking",Article,Included,"Included: satisfies IC1, IC3 — analyzes structural dimensions, purposes, or attributes of meetings."
Culture-driven scripts for meetings: An integrative theoretical lens for studying workplace meetings,Köhler T.; Tenzer H.; Cramton C.D.,2023,Organizational Psychology Review,10.1177/20413866221128968,2-s2.0-85139222727,"The current research conceptualizes workplace meetings as socially embedded forms of organizing and proposes that cross-cultural comparisons of workplace meetings offer insights into differences in meeting structures and processes. This provides a deeper understanding of how meetings drive organizing in different cultural settings. Specifically, we build programmatic theory proposing cognitive and behavioral scripts as a promising theoretical lens through which to capture and integrate sociocultural influences on workplace meetings. We adapt Cramton et al.'s (2021) cultural coordination scripts formulation (consisting of the task setting, role structure, temporal structure, and cues) to develop an interpretive framework for workplace meeting processes that orients future research on cross-cultural meetings. We further integrate existing research on cross-cultural meeting differences to develop a generic prototype meeting script and two illustrative examples of culturally specific meeting scripts (for German and U.S.-American meetings) to demonstrate the practical usefulness and usability of this programmatic theory. © The Author(s) 2022.; Workplace meetings are used by organizations to maintain their overarching goals and purpose. They are an important, maybe the most important, tool through which members of the organization ensure its functioning and the pursuit of its purpose. The form of meetings and the processes involved in carrying out meetings are influenced by the cultural context(s) in which the meeting is held and the organization resides. Previous research has identified meeting characteristics and processes that differ across cultures. Comparisons of meeting structures and processes embedded in different cultural contexts can help researchers explore how variations in meeting characteristics contribute to organizing in organizations. This in turn allows researchers to better illuminate, explain, and guide the management of meetings to support their core goals and purpose. In the current paper, we propose a novel way of conceptualizing, capturing, and studying cross-cultural variations in meeting structures and processes, using the lens of cognitive and behavioral scripts. Scripts are cognitive structures that organize knowledge around how events typically unfold and provide prescriptions for the ways in which actors should interact over time to achieve coordinated action in a task situation. We employ Cramton et al.'s (2021) cultural coordination scripts formulation to create a definition of meeting scripts as well as prototype meeting scripts that can provide the foundation for future meetings research and for improved facilitation of cross-cultural meetings in organizations. Furthermore, we build an overarching, integrative theoretical framework for understanding cross-cultural meeting differences, which will guide future research endeavors into and theorizing about meetings in different cultural contexts. © The Author(s) 2022.",cultural differences; programmatic theory; scripts; sociocultural view; workplace meetings,Article,Included,"Included: satisfies IC1, IC3 — analyzes structural dimensions, purposes, or attributes of meetings."
Peace-ful web event extraction and processing as bitemporal mutable events,Furche T.; Grasso G.; Huemer M.; Schallhart C.; Schrefl M.,2016,ACM Transactions on the Web,10.1145/2911989,2-s2.0-84983683607,"The web is the largest bulletin board of the world. Events of all types, from flight arrivals to business meetings, are announced on this board. Tracking and reacting to such event announcements, however, is a tedious manual task, only slightly alleviated by email or similar notifications. Announcements are published with human readers in mind, and updates or delayed announcements are frequent. These characteristics have hampered attempts at automatic tracking. PeaCE provides the first integrated framework for event processing on top of web event ads, consisting of event extraction, complex event processing, and action execution in response to these events. Given a schema of the events to be tracked, the framework populates this schema by extracting events from announcement sources. This extraction is performed by little programs called wrappers that produce the events including updates and retractions. PEACE then queries these events to detect complex events, often combining announcements from multiple sources. To deal with updates and delayed announcements, PEACE's schemas are bitemporal, to distinguish between occurrence and detection time. This allows complex event specifications to track updates and to react upon differences in occurrence and detection time. In case of new, changing, or deleted events, PEACE allows one to execute actions, such as tweeting or sending out email notifications. Actions are typically specified as web interactions, for example, to fill and submit a form with attributes of the triggering event. Our evaluation shows that PEACE's processing is dominated by the time needed for accessing the web to extract events and perform actions, allotting to 97.4%. Thus, PEACE requires only 2.6% overhead, and therefore, the complex event processor scales well even with moderate resources. We further show that simple and reasonable restrictions on complex event specifications and the timing of constituent events suffice to guarantee that PEACE only requires a constant buffer to process arbitrarily many event announcements. © 2016 ACM.",Active database systems; Complex event processing; Temporal databases; Web engineering; Web events,Article,Excluded,Excluded: title indicates primary domain is unrelated to professional meeting taxonomy or structure (paper only mentions meetings incidentally).
A Study on Interface Design to Provide Effective Meeting Summary Information: Focused on Narrative Chart and Topic Map Visualization,Lim S.; Park C.; Han H.; Ho J.; Hong J.; Lee S.; Lee K.,2021,Archives of Design Research,10.15187/adr.2021.02.34.1.115,2-s2.0-85101806174,"Background There are many cases in which experts work collaboratively in the workplace. The proportion of workplace meetings continues to increase. The purpose of this study is to develop a visualization system that summarizes meetings, which occur in the workplace. Methods We confirmed that meetings can be classified into discussion-centered and topic-oriented types. These are proceeded with the review on studies of office meeting analysis. To devise a method of summarizing contents of meetings, we selected the visualization method. A narrative chart technique was selected for the summary visualization of the discussion-centered meeting, and a topic map technique was selected for the summary visualization of the topic-oriented meeting. Design tasks were selected according to their requirements through discussions with domain experts and a visualization expert. Results We conducted two controlled usability tests using actual meeting data. Narrative chart–based visualization was proven to effectively provide a general overview of the meeting and the participants’ utterance patterns. Topic map-based visualization demonstrated that the contents of the meeting can be inferred through the relationship between the information on various keywords. Conclusions This study proposed a meeting summary visualization system that is suitable for different workplace meeting types based on the requirements of meeting records and meeting type classification. Two visualization methods were developed to overcome the limitations of the previous one that provides all meeting summary information in one system without considering the differences in the characteristics of the meeting types. © 2021. This is an Open Access article distributed under the terms of the Creative Commons Attribution Non-Commercial License (http://creativecommons.org/licenses/by-nc/3.0/), which permits unrestricted educational and non-commercial use, provided the original work is properly cited.",Data Visualization System; Design Research; Meeting Summarization; User Interface,Article,Included,"Included: satisfies IC1, IC2, IC3 — proposes or applies a taxonomy/classification framework for meetings; analyzes structural dimensions, purposes, or attributes of meetings."
THE STAFF MEETING … AND BEYOND …*,Kello J.E.; Allen J.A.,2020,Research on Managing Groups and Teams,10.1108/S1534-085620200000020002,2-s2.0-85130060942,"Previous research on workplace meetings identified critical design features, leader behaviors, group dynamics, post-meeting actions, and other factors which help determine the effectiveness of the meeting. But as much as the authors acknowledge that meetings may differ from each other, much of the research appears to assume that it is meaningful to talk about “the meeting” as a single, generic entity (most commonly, the regularly scheduled staff or department meeting). In fact, though, there are several common types of meetings which vary among themselves in terms of a number of measurable parameters such as structure, meeting members, meeting leader, timing and duration, and scope. It is a gratuitous assumption that what the authors know about workplace meetings based on one especially common type applies to all workplace meetings. This chapter offers a historical review of previous attempts to classify meeting types; it then overviews several common types which deviate from the standard staff meeting paradigm, including project team meetings, debrief meetings, committee meetings, site-wide meetings, shift change meetings, and crew formation meetings. In comparing these types to the staff meeting, the authors identify some of the critical differences, thereby providing a first step toward a true taxonomy of meetings. © 2020 by Emerald Publishing Limited All rights of reproduction in any form reserved.",critical parameters of meetings; meeting types; meetings research and practice; staff meeting; taxonomy; Workplace meetings,Book chapter,Included,"Included: satisfies IC1, IC2, IC3 — proposes or applies a taxonomy/classification framework for meetings; analyzes structural dimensions, purposes, or attributes of meetings."
Calibration and validation working group for surface biology and geology (SBG),Kokaly R.F.; Turpie K.R.,2019,International Geoscience and Remote Sensing Symposium (IGARSS),10.1109/IGARSS.2019.8900236,2-s2.0-85113838535,"A calibration/validation (cal/val) working group (CVWG) was established as part of a US government study of the Surface Biology and Geology (SBG) observing system priority identified in the 2017 National Academies of Sciences, Engineering, and Medicine decadal survey of Earth sciences and applications [1]. The 2017 decadal survey recommended the SBG mission as a designated observable to improve measurements of Earth's surface characteristics important for habitation, food, water, and many other natural resources. The candidate approach presented in the 2017 decadal survey was an imaging spectrometer spanning the visible and shortwave infrared (VSWIR) wavelength region and multi- or hyperspectral imagery in the thermal infrared (TIR). The SBG study is evaluating the candidate approach and other potential architectures in meeting science and application objectives. The SBG-CVWG, started in late 2018, has begun to identify elements of cal/val related to potential mission architectures. With the input of CVWG members and by engagement with the broader scientific community, other components of a cal/val framework are being defined including, prelaunch characterization and calibration, on-orbit calibration and monitoring, vicarious terrestrial/celestial calibration, data product validation, and intercomparison and potentially inter-calibration when multiple platforms are used.  © 2019 IEEE.",Calibration; Earth science missions; Hyperspectral remote sensing; Imaging spectroscopy; Validation,Conference paper,Excluded,Excluded per EC5 (conference proceedings index entry or non-research document — no original empirical or conceptual contribution to meeting taxonomy).
Toward a Strategic Perspective of Meeting Participation,Beck S.J.; Paskewitz E.A.; Allen J.A.,2025,Organizational Psychology Review,10.1177/20413866231226405,2-s2.0-86000734288,"Over the years, meeting attendance has become a larger and larger portion of employee workload. Meetings are salient locations of work, where group members interact in a way that advances the organizational goal. Since meeting interactions showcase group members’ preparation and competence, meeting participation is important not only to the purposes of the group but also to the reputation and credibility of the group members. The theoretical framework in this essay showcases the factors that influence how group members choose to participate in meetings. Group members must balance the need to maintain a good impression during meeting interaction while also weighing how much energy to use given the myriad responsibilities that members must juggled. Different meeting characteristics (e.g., virtual meetings and group size) may influence how members try to maintain good impressions and conserve energy. The intersection of these member goals creates five ways that individuals participate in meetings: full participation, nonparticipation, pretend participation, token legitimacy, and off/on participation. Meeting members may use one or several of these approaches during the course of a meeting, depending on how they balance their impression management and resource conservation goals. © The Author(s) 2024.; Participation in meetings is a multifaceted process. Meeting members must consider individual and meeting goals when creating their messages, as well as a host of other context and resource factors. The purpose of this essay is to create a framework through which to consider meeting member contributions. Pulling from literature in impression management, resource conservation, and meeting science, the essay introduces a strategic perspective of meeting participation and categorizes five meeting participation types. Implications of this perspective on future meeting research are considered. © The Author(s) 2024.",communication strategy; impression management; meeting participation; resource conservation,Article,Included,"Included: satisfies IC1, IC2, IC3 — proposes or applies a taxonomy/classification framework for meetings; analyzes structural dimensions, purposes, or attributes of meetings."
