Title,Authors,Year,Source title,DOI,EID,Abstract,Author Keywords,Document Type,Selection_Decision,Selection_Justification
Flexible openCL accelerated disparity estimation for video communication applications,Weigel C.; Treutner N.,2011,"3DTV Conference: The True Vision - Capture, Transmission and Display of 3D Video, 3DTV-CON 2011 - Proceedings",10.1109/3DTV.2011.5877207,2-s2.0-79960118862,"Due to widespread broadband connections in normal households, the use of video chats via Internet is no longer limited to business meetings. However, the camera configuration usually makes it impossible to achieve direct eye contact between the conversational partners. This effect can be compensated using virtual view synthesis methods based on disparity maps. The virtual camera is positioned behind the communications windows and thus re-establishes the eye-contact. Obtaining a good disparity map is still a challenging problem and, with respect to video communication, must perform at interactive frame rates. In this paper we present optimized algorithms for disparity estimation that run in near real time. Recent developments in the consumer-hardware industry allow the implementation of complex algorithms for eye gaze correction, which can be used with relatively inexpensive out-of-the-box components. We employ the newly introduced OpenCL Framework and present an implementation of several optimized algorithms on a Graphics Processing Unit (GPU). Our implementation supports different methods for cost-estimation and aggregation, which we can combine flexibly. We present a method to efficiently implement a dynamic programming approach on the GPU. Our contribution makes it possible to interactively change parameters of the algorithms and get instant visual feedback which is crucial in algorithm development and parameter tuning. We also show first results of virtual views that re-establish the eye contact. © 2011 IEEE.",disparity estimation; GPGPU; OpenCL; video communication,Conference paper,Excluded,Excluded: title indicates primary domain is unrelated to professional meeting taxonomy or structure (paper only mentions meetings incidentally).
Commissive speech act use in intercultural business meetings,Bilbow G.T.,2002,IRAL - International Review of Applied Linguistics in Language Teaching,10.1515/iral.2002.014,2-s2.0-85007090372,"This paper focuses on the use of commissive speech acts (CSAs) in in a range of business meetings involving participants from different cultural groups, recorded at a large multinational airline corporation in Hong Kong. After a description of a simple framework for classifying commissive speech acts, the paper presents an analysis of the lexico-grammatical realization of commissive speech acts in the corpus. The paper concludes that two factors (participants' cultural predispositions and meeting-type) appear to significantly affect how and when commissive speech acts are used in business meetings in the corpus by different groups. The paper then briefly discusses the possible impact of differences between cultural groups in their patterns of commissive speech act use in multicultural group contexts. © 2002, by Walter de Gruyter GmbH & Co. KG. All rights reserved.",,Article,Included,"Included: satisfies IC1, IC3 — analyzes structural dimensions, purposes, or attributes of meetings."
Quality-based automatic classification for presentation slides,Kim S.; Jung W.; Han K.; Lee J.-G.; Yi M.Y.,2014,Lecture Notes in Computer Science (including subseries Lecture Notes in Artificial Intelligence and Lecture Notes in Bioinformatics),10.1007/978-3-319-06028-6_69,2-s2.0-84899926392,"Computerized presentation slides have become essential for effective business meetings, classroom discussions, and even general events and occasions. With the exploding number of online resources and materials, locating the slides of high quality is a daunting challenge. In this study, we present a new, comprehensive framework of information quality developed specifically for computerized presentation slides on the basis of a user study involving 60 university students from two universities and extensive coding analysis, and explore the possibility of automatically detecting the information quality of slides. Using the classifications made by human annotators as the golden standard, we compare and evaluate the performance of alternative information quality features and dimensions. The experimental results support the validity of the proposed approach in automatically assessing and classifying the information quality of slides. © 2014 Springer International Publishing Switzerland.",Classification; Information Quality (IQ); Presentation Slides,Conference paper,Excluded,Excluded: title indicates primary domain is unrelated to professional meeting taxonomy or structure (paper only mentions meetings incidentally).
Group Dynamics in the Metaverse: A Conceptual Framework and First Empirical Insights,Grabowski M.; Lehmann-Willenbrock N.; Rings S.; Blanchard A.; Steinicke F.,2024,Small Group Research,10.1177/10464964241274120,2-s2.0-85202167196,"The metaverse offers new technological possibilities for conducting 3D immersive meetings with head-mounted displays that can enrich virtual teamwork. To conceptualize this new interaction space, we synthesize interdisciplinary findings from human-computer interaction literature, group research, and meeting science. We develop a conceptual framework of 3D immersive group meetings that integrates technological design characteristics, subjective attendee experiences, mediating mechanisms, and meeting outcomes. As a first empirical glimpse into this framework, we include a pilot study of group member’s self-reported experiences and observed group dynamics in the metaverse. Building on our framework and first empirical insights, we discuss implications for future investigations of group dynamics in the metaverse. © The Author(s) 2024.",entitativity; group dynamics; interaction flow; meetings; metaverse; virtual reality,Article,Included,"Included: satisfies IC1, IC3 — analyzes structural dimensions, purposes, or attributes of meetings."
Developing information quality assessment framework of presentation slides,Kim S.; Lee J.-G.; Yi M.Y.,2017,Journal of Information Science,10.1177/0165551516661917,2-s2.0-85034615463,"Computerized presentation slides have become essential for many occasions such as business meetings, classroom discussions, multipurpose talks and public events. Given the tremendous increases in online resources and materials, locating high-quality slides relevant to a given task is often a formidable challenge, particularly when a user looks for superior quality slides. This study proposes a new, comprehensive framework for information quality (IQ) developed specifically for computerized presentation slides and explores the possibility of automatically detecting the IQ of slides. To determine slide-specific IQ criteria as well as their relative importances, we carried out a user study, involving 60 participants from two universities, and conducted extensive coding analysis. Further, we subsequently conducted a series of multiple experiments to examine the validity of the IQ features developed on the basis of the selected criteria from the user study. The study findings contribute to identifying key dimensions and related features that can improve effective IQ assessments of computerized presentation slides. © 2016, © The Author(s) 2016.",information quality (IQ); IQ assessment; presentation slides; qualitative study; slide ranking,Article,Excluded,Excluded: title indicates primary domain is unrelated to professional meeting taxonomy or structure (paper only mentions meetings incidentally).
Model to estimate threshold mechanical stability of lower lateral Cartilage,Kim J.H.; Hamamoto A.; Kiyohara N.; Wong B.J.F.,2015,JAMA Facial Plastic Surgery,10.1001/jamafacial.2015.0255,2-s2.0-84941887555,"IMPORTANCE In rhinoplasty, techniques used to alter the shape of the nasal tip often compromise the structural stability of the cartilage framework in the nose. Determining the minimum threshold level of cartilage stiffness required to maintain long-Term structural stability is a critical aspect in performing these surgical maneuvers. OBJECTIVE To quantify the minimum threshold mechanical stability (elastic modulus) of lower lateral cartilage (LLC) according to expert opinion. METHODS Five anatomically correct LLC phantoms were made from urethane via a 3-dimensional computer modeling and injection molding process. All 5 had identical geometry but varied in stiffness along the intermediate crural region (0.63-30.6 MPa). DESIGN, SETTING, AND PARTICIPANTS A focus group of experienced rhinoplasty surgeons (n = 33) was surveyed at a regional professional meeting on October 25, 2013. Each survey participant was presented the 5 phantoms in a random order and asked to arrange the phantoms in order of increasing stiffness based on their sense of touch. Then, they were asked to select a single phantom out of the set that they believed to have the minimum acceptable mechanical stability for LLC to maintain proper form and function. MAIN OUTCOMES AND MEASURES A binary logistic regressionwas performed to calculate the probability of mechanical acceptability as a function of the elastic modulus of the LLC based on survey data. A Hosmer-Lemeshow test was performed to measure the goodness of fit between the logistic regression and survey data. The minimum threshold mechanical stability for LLC was taken at a 50% acceptability rating. RESULTS Phantom 4 was selected most frequently by the participants as having the minimum acceptable stiffness for LLC intermediate care. The minimum threshold mechanical stability for LLC was determined to be 3.65 MPa. The Hosmer-Lemeshow test revealed good fit between the logistic regression and survey data (X23 = 0.92, P = .82). CONCLUSIONS AND RELEVANCE This study presents a novelmethod of modeling anatomical structures and quantifying the mechanical properties of nasal cartilage. Quantifying these parameters is an important step in guiding surgical maneuvers performed in rhinoplasty. Copyright © 2015 American Medical Association. All rights reserved.",,Article,Excluded,Excluded: title indicates primary domain is unrelated to professional meeting taxonomy or structure (paper only mentions meetings incidentally).
Modelling media choices in business organizations: Implications for analyzing telecommunications-transportation interactions,Moore A.; Jovanis P.P.,1988,Transportation Research Part A: General,10.1016/0191-2607(88)90004-0,2-s2.0-0024053119,"A framework to analyze the impact of the new electronic communication technologies on transportation systems in the business setting has been proposed. A component of the framework that focuses on the media choice processes of individuals was empirically tested using scenarios in which the physical mail media, courier services, the telephone, voice mail, and electronic mail were alternatives to complete information communication tasks. The media choice model developed in this research emphasizes the influence of the context of the communication activity on media choice. Individual and organizational characteristics are explicitly considered, along with variables describing the communication activity itself, and the relationship between the initiator and the recipient of the communication. These characteristics determine the relative importance of a set of communication attributes and personal needs which are then matched against the individual's perceptions and feelings about the media to form preferences and choices in specific contexts. Empirical results are presented using preference logit models for a series of information communication situations. Significant variations in preferences and the levels of significance of the independent variables provided evidence of the strong influence the context of the communication activity has on media choice. Implications of these results are discussed in terms of other types of business meetings which may involve choices between telecommunications media and transportation modes. The primary contribution of this research is a methodology that can be extended to rigorously analyze telecommunications-transportation interactions. The paper discusses some of the issues that need to be addressed in modelling telecommunications-transportation interactions. © 1988.",,Article,Excluded,"Excluded: satisfies IC1 but does not meet IC2 or IC3 (no taxonomy, typology, classification, or structural/dimensional meeting analysis identified)."
National qualifications frameworks: Conceptual and methodological principles in the context of unresolved issues,Oleynikova O.N.; Muravyeva A.A.; Aksenova N.M.,2018,Obrazovanie i Nauka,10.17853/1994-5639-2018-6-70-89,2-s2.0-85062532359,"Introduction. The deficiency of highly skilled professionals meeting the requirements of the modern labour market has become the reason for search of new, more effective regulation mechanisms of vocational training and personnel certification for post-industrial knowledge-based economy. As international practice demonstrates, such mechanisms could be the National Qualifications Systems (NQS), National Qualifications Framework (NQF) and Professional Standards (PS) that are comparable with the European Qualifications Framework (EQF), designed for lifelong education implementation. Aim. Having analysed the international experience, the aims of the article are to discuss the issues of NQF and PS implementation and to consider the possibility of adaptation of the best models of foreign practice for the Russian realities. Methodology and research methods. The methods of collecting empirical information, comparative and conceptual-terminological analysis were applied in the course of studying methodological and methodical aspects of construction and functioning of NQS; the methods of generalization, interpretation and modeling were applied. The results and scientific novelty. The complex of the systemic problems which restrict the process of NQS formation launched in Russia is noted. The revealed reasons are explained by the developed psychological, organizational and methodical stereotypes; the ways of overcoming the current problems are outlined. According to the authors, the key problem is the dichotomy between professional and educational qualifications which does not exist in the international discourse, but is deeply rooted in consciousness of the Russians. Such a distinction involves irrational duplication of procedures for the qualifications assessment and generates a number of other difficulties interfering effective development of NQS and obtaining the maximum benefits from its use. In order to resolve the revealed contradictions and shortcomings, the authors analysed the experience of other countries where national systems of qualifications are implemented. Based on the international practice invariant systemically important parameters and variable characteristics of NQS and NQF are singled out and described. The typology of the qualifications framework and the principles of their design are proved. Practical significance. The research materials and findings, recommendations and suggestions for integrated improvement of mechanisms of Federal State Educational Standards, introduced PS and the system of independent assessment of qualifications can be useful for professional development of the experts and methodologists participating in design and modernization of NQF, development of professional and educational standards along with the main and additional programs of vocational training. © 2018 Obrazovanie i Nauka. All rights reserved.",Competences; Education Standards; Infrastructure of the National Qualifications System; Learning outcomes; National Qualifications Framework (NQF); National Qualifications System (NQS); Professional Standards; Qualification,Article,Excluded,Excluded: title indicates primary domain is unrelated to professional meeting taxonomy or structure (paper only mentions meetings incidentally).
Integrating workplace meetings and team creative process literature: A multi-level perspective,Murugavel V.R.; Reiter-Palmon R.,2023,Organizational Psychology Review,10.1177/20413866221143369,2-s2.0-85147432545,"Expanding existing meeting typologies, this paper introduces a model of the team creative process in meetings to better capture and study the full breath of meeting activity that results in creative outcomes. The primary goal of this work is to describe the processes that occur in the team creative process in meetings at the individual and team levels. A multi-level model that depicts the emergence of team creative cognitive processes from individual-level cognitions is presented. The nature of emergence of team creative processes is detailed. Research on creativity and meetings is integrated to better understand how meeting design characteristics influence creative output. This review of research is distilled to provide practical recommendations to best construct meetings to facilitate individual and team creativity. Additionally, the role of related team states in creative processes meetings is outlined. Finally, paths for future research on creativity in meetings are discussed. © The Author(s) 2023.",creative process; groups/teams; multi-level; workplace meetings,Article,Included,"Included: satisfies IC1, IC3 — analyzes structural dimensions, purposes, or attributes of meetings."
Bitemporal complex event processing of web event advertisements,Furche T.; Grasso G.; Huemer M.; Schallhart C.; Schrefl M.,2013,Lecture Notes in Computer Science (including subseries Lecture Notes in Artificial Intelligence and Lecture Notes in Bioinformatics),10.1007/978-3-642-41154-0_25,2-s2.0-84887427031,"The web is the largest bulletin board of the world. Events of all types, from flight arrivals to business meetings, are announced on this board. Tracking and reacting to such event announcements, however, is a tedious manual task, only slightly alleviated by email or similar notifications. Announcements are published with human readers in mind, and updates or delayed announcements are frequent. These characteristics have hampered attempts at automatic tracking. PeaCE provides the first integrated framework for event processing on top of web event ads. Given a schema of events to be tracked, the framework populates this schema through compact wrappers for event announcement sources. These wrappers produce events including updates and retractions. PeaCE then queries these events to detect complex events, often combining announcements from multiple sources. To deal with updates and delayed announcements, PeaCE's schemas are bitemporal so as to distinguish between occurrence and detection time. This allows complex event specifications to track updates and to react to differences in occurrence and detection time. Our evaluation shows that extracting the event from an announcement dominates the processing of PeaCE and that the complex event processor deals with several event announcement sources even with moderate resources. We further show, that simple restrictions on the complex event specifications suffice to guarantee that PEACE only requires a constant buffer to process arbitrarily many event announcements. © 2013 Springer-Verlag.",,Conference paper,Excluded,Excluded: title indicates primary domain is unrelated to professional meeting taxonomy or structure (paper only mentions meetings incidentally).
Restructuring of the Québec health network and its effects on the profession of home health aides and their occupational health and safety,Cloutier E.; David H.; Ledoux E.; Gagnon I.; Bourdouxhe M.; Ouellet F.,2007,New Solutions,10.2190/pv12-897h-6546-69w8,2-s2.0-34848839258,"The Québec health sector is facing profound macroeconomic and macro-organizational changes. This article addresses the impact of these changes on the work of home health aides (HHAs) and their occupational health and safety (OHS). The study was carried out in the home care services of four local community service centers (CLSCs) with different organizational characteristics. It is based on an analysis by triangulation of 66 individual and group interviews, 11 work days, and 35 multidisciplinary or professional meetings observed, as well as administrative documents. HHAs are experiencing an erosion of their job because the relational and emotional components of their work are disappearing. This results in an increase in musculoskeletal and psychological health problems. This study also shows that managers’ decisions can reduce or increase the HHAs’ work constraints. Stability in the clientele served and the possibility of organizing their routes are good examples of positive impacts. © 2007, Baywood Publishing Co., Inc.",,Article,Excluded,Excluded: title indicates primary domain is unrelated to professional meeting taxonomy or structure (paper only mentions meetings incidentally).
Making Every Meeting Count: A Qualitative Investigation of Multiteam Meeting Events and Their Role in Supporting Coordinated Cancer Care Delivery,Wolf A.V.; Hedrick K.N.; Begerowski S.R.; Wiper D.W.; Carter D.R.; Shuffler M.L.,2023,JCO Oncology Practice,10.1200/OP.22.00388,2-s2.0-85146193407,"PURPOSE:This research considers how cross-disciplinary cancer care meetings can facilitate coordination within the multiteam systems (MTSs) that provide inpatient hospital care. We conducted a series of interviews and observations with members of a single cancer care MTS to address the following research questions: (1) what are the key characteristics of MTS cancer care meetings (with regard to composition, focus, and structure)? and (2) how is cross-team coordination acknowledged and addressed during these meetings?METHODS:In this single-site case study of a MTS operating to provide gynecologic oncology care within a teaching hospital, two types of meetings, called rounds and huddles, were held consistently. We used qualitative methods, including interviews with health care professional subject matter experts and 30 hours of observations of cancer care meetings, and analyzed the data in three stages of qualitative coding.RESULTS:Our analyses resulted in a thematic framework detailing key processes, and subprocesses, identified as central to the activities of observed cancer care meetings. Key processes include information sharing, gaining clarity, strategizing, and pedagogy. Discussions and explanations of this framework showcase the ways in which MTS meetings can bolster cross-team coordination and facilitate MTS activities.CONCLUSION:Inpatient cancer care meetings provide opportunities to facilitate MTS coordination in several ways, yet doing so does not come without challenges. Considering these results together with insights from meeting science and MTS research, this article concludes by putting forward practical recommendations for leveraging opportunities and overcoming challenges to use cancer care meetings as tools to support cross-team coordination. © American Society of Clinical Oncology.",,Article,Included,"Included: satisfies IC1, IC2 — proposes or applies a taxonomy/classification framework for meetings."
Dialogue Orientations in Workplace Meetings,Cionea I.A.; Kavya P.; Wyant M.H.,2021,Management Communication Quarterly,10.1177/0893318920970542,2-s2.0-85095813570,"This study examined conversation preferences in workplace meetings via a cross-sectional survey of working adults (N = 217). Dialogue orientations from the argumentation literature were employed in conjunction with a typology of meetings proposed by the authors to examine communication and satisfaction in various types of meetings. Results revealed that three dialogue orientations (negotiation, information-giving, and eristic) predicted meeting satisfaction to a moderate degree. In addition, the use of several dialogue orientations differed depending on meeting type and an individual’s supervisory role. We discuss how these results can inform our understanding of dialogue opportunities and constraints during meetings, and recommend ways for improving meetings. These results are discussed in the context of organizational communication, including practical recommendations and theoretical implications. © The Author(s) 2020.",dialogue orientations; meeting satisfaction; supervisory role; workplace meetings,Article,Included,"Included: satisfies IC1, IC2, IC3 — proposes or applies a taxonomy/classification framework for meetings; analyzes structural dimensions, purposes, or attributes of meetings."
